aiter/configs/model_configs/hy3_fp8_pertensor_tuned_fmoe.csv
cu_num,token,model_dim,inter_dim,expert,topk,act_type,dtype,q_dtype_a,q_dtype_w,q_type,use_g1u1,doweight_stage1,q_dtype_a2,q_dtype_w2,q_type2,block_m,block_m2,ksplit,us1,kernelName1,err1,us2,kernelName2,err2,us,run_1stage,tflops,bw,_tag
80,32,4096,192,193,9,ActivationType.Silu,torch.bfloat16,torch.float8_e4m3fnuz,torch.float8_e4m3fnuz,QuantType.per_Tensor,1,0,torch.float8_e4m3fnuz,torch.float8_e4m3fnuz,QuantType.per_Tensor,16,16,0,74.5647,moe_ck2stages_gemm1_256x16x64x256_1x4_MulABScale_v1_Nswizzle0_Quant1_MulRoutedWeight0_silu_F8_F8_B16,0.0%,62.1949,moe_ck2stages_gemm2_64x16x64x64_1x1_MulABScaleExpertWeight_v1_Nswizzle0_Quant1_MulRoutedWeight1_F8_F8_B16,0.1%,136.7596,0,9.94,3332.4,
80,64,4096,192,193,9,ActivationType.Silu,torch.bfloat16,torch.float8_e4m3fnuz,torch.float8_e4m3fnuz,QuantType.per_Tensor,1,0,torch.float8_e4m3fnuz,torch.float8_e4m3fnuz,QuantType.per_Tensor,16,16,0,90.9757,moe_ck2stages_gemm1_256x16x64x256_1x4_MulABScale_v1_Nswizzle0_Quant1_MulRoutedWeight0_silu_F8_F8_B16,0.0%,74.9513,moe_ck2stages_gemm2_64x16x64x64_1x1_MulABScaleExpertWeight_v1_Nswizzle0_Quant1_MulRoutedWeight1_F8_F8_B16,0.1%,165.927,0,16.38,2748.98,
80,128,4096,192,193,9,ActivationType.Silu,torch.bfloat16,torch.float8_e4m3fnuz,torch.float8_e4m3fnuz,QuantType.per_Tensor,1,0,torch.float8_e4m3fnuz,torch.float8_e4m3fnuz,QuantType.per_Tensor,16,16,0,96.0248,moe_ck2stages_gemm1_256x16x64x256_1x4_MulABScale_v1_Nswizzle0_Quant1_MulRoutedWeight0_silu_F8_F8_B16,0.0%,86.6461,moe_ck2stages_gemm2_64x16x64x64_1x1_MulABScaleExpertWeight_v1_Nswizzle0_Quant1_MulRoutedWeight1_F8_F8_B16,0.1%,182.6709,0,29.76,2501.31,
80,256,4096,192,193,9,ActivationType.Silu,torch.bfloat16,torch.float8_e4m3fnuz,torch.float8_e4m3fnuz,QuantType.per_Tensor,1,0,torch.float8_e4m3fnuz,torch.float8_e4m3fnuz,QuantType.per_Tensor,16,16,0,103.7028,moe_ck2stages_gemm1_256x16x64x256_1x4_MulABScale_v1_Nswizzle0_Quant1_MulRoutedWeight0_silu_F8_F8_B16,0.0%,117.3965,moe_ck2stages_gemm2_64x16x64x64_1x1_MulABScaleExpertWeight_v1_Nswizzle0_Quant1_MulRoutedWeight1_F8_F8_B16,0.1%,221.0993,0,49.17,2073.68,
80,512,4096,192,193,9,ActivationType.Silu,torch.bfloat16,torch.float8_e4m3fnuz,torch.float8_e4m3fnuz,QuantType.per_Tensor,1,0,torch.float8_e4m3fnuz,torch.float8_e4m3fnuz,QuantType.per_Tensor,32,32,0,115.1886,moe_ck2stages_gemm1_256x32x64x256_1x4_MulABScale_v1_Nswizzle0_Quant1_MulRoutedWeight0_silu_F8_F8_B16,0.0%,153.3399,moe_ck2stages_gemm2_256x32x64x64_1x4_MulABScaleExpertWeight_v1_Nswizzle0_Quant1_MulRoutedWeight1_F8_F8_B16,0.1%,268.5285,0,80.97,1719.13,
80,1024,4096,192,193,9,ActivationType.Silu,torch.bfloat16,torch.float8_e4m3fnuz,torch.float8_e4m3fnuz,QuantType.per_Tensor,1,0,torch.float8_e4m3fnuz,torch.float8_e4m3fnuz,QuantType.per_Tensor,64,64,0,151.5745,moe_ck2stages_gemm1_256x64x64x128_1x4_MulABScale_v1_Nswizzle0_Quant1_MulRoutedWeight0_silu_F8_F8_B16,0.0%,242.056,moe_ck2stages_gemm2_256x64x64x64_1x4_MulABScaleExpertWeight_v1_Nswizzle0_Quant1_MulRoutedWeight1_F8_F8_B16,0.1%,393.6305,0,110.48,1188.75,
80,2048,4096,192,193,9,ActivationType.Silu,torch.bfloat16,torch.float8_e4m3fnuz,torch.float8_e4m3fnuz,QuantType.per_Tensor,1,0,torch.float8_e4m3fnuz,torch.float8_e4m3fnuz,QuantType.per_Tensor,64,64,0,264.6795,moe_ck2stages_gemm1_256x64x64x128_1x4_MulABScale_v1_Nswizzle0_Quant1_MulRoutedWeight0_silu_F8_F8_B16,0.0%,456.5108,flydsl_moe2_afp8_wfp8_bf16_t64x128x64_atomic_w2_bnt0,0.1%,721.1903,0,120.6,666.27,
80,4096,4096,192,193,9,ActivationType.Silu,torch.bfloat16,torch.float8_e4m3fnuz,torch.float8_e4m3fnuz,QuantType.per_Tensor,1,0,torch.float8_e4m3fnuz,torch.float8_e4m3fnuz,QuantType.per_Tensor,64,64,0,447.6221,moe_ck2stages_gemm1_256x64x64x128_1x4_MulABScale_v1_Nswizzle0_Quant1_MulRoutedWeight0_silu_F8_F8_B16,0.0%,788.4973,flydsl_moe2_afp8_wfp8_bf16_t64x128x64_atomic_w1_bnt0,0.1%,1236.1194,0,140.72,409.08,
80,8192,4096,192,193,9,ActivationType.Silu,torch.bfloat16,torch.float8_e4m3fnuz,torch.float8_e4m3fnuz,QuantType.per_Tensor,1,0,torch.float8_e4m3fnuz,torch.float8_e4m3fnuz,QuantType.per_Tensor,64,64,0,800.8209,moe_ck2stages_gemm1_256x64x64x128_1x4_MulABScale_v1_Nswizzle0_Quant1_MulRoutedWeight0_silu_F8_F8_B16,0.0%,1490.5757,flydsl_moe2_afp8_wfp8_bf16_t64x128x64_atomic_w1_bnt0,0.1%,2291.3966,0,151.83,242.65,
80,16384,4096,192,193,9,ActivationType.Silu,torch.bfloat16,torch.float8_e4m3fnuz,torch.float8_e4m3fnuz,QuantType.per_Tensor,1,0,torch.float8_e4m3fnuz,torch.float8_e4m3fnuz,QuantType.per_Tensor,64,64,0,1520.6436,moe_ck2stages_gemm1_256x64x64x128_1x4_MulABScale_v1_Nswizzle0_Quant1_MulRoutedWeight0_silu_F8_F8_B16,0.0%,2981.152,flydsl_moe2_afp8_wfp8_bf16_t64x128x64_atomic_w4_bnt0,0.1%,4501.7956,0,154.56,145.87,
80,32768,4096,192,193,9,ActivationType.Silu,torch.bfloat16,torch.float8_e4m3fnuz,torch.float8_e4m3fnuz,QuantType.per_Tensor,1,0,torch.float8_e4m3fnuz,torch.float8_e4m3fnuz,QuantType.per_Tensor,64,64,0,2976.7776,moe_ck2stages_gemm1_256x64x64x128_1x4_MulABScale_v1_Nswizzle0_Quant1_MulRoutedWeight0_silu_F8_F8_B16,0.0%,5969.1613,moe_ck2stages_gemm2_256x64x64x64_1x4_MulABScaleExpertWeight_v1_Nswizzle0_Quant1_MulRoutedWeight1_F8_F8_B16,0.1%,8945.9389,0,155.55,95.91,
80,65536,4096,192,193,9,ActivationType.Silu,torch.bfloat16,torch.float8_e4m3fnuz,torch.float8_e4m3fnuz,QuantType.per_Tensor,1,0,torch.float8_e4m3fnuz,torch.float8_e4m3fnuz,QuantType.per_Tensor,64,64,0,5941.9919,moe_ck2stages_gemm1_256x64x64x128_1x4_MulABScale_v1_Nswizzle0_Quant1_MulRoutedWeight0_silu_F8_F8_B16,0.0%,12086.0436,flydsl_moe2_afp8_wfp8_bf16_t64x128x64_atomic_w4_bnt0,0.1%,18028.0355,0,154.38,69.93,
80,131072,4096,192,193,9,ActivationType.Silu,torch.bfloat16,torch.float8_e4m3fnuz,torch.float8_e4m3fnuz,QuantType.per_Tensor,1,0,torch.float8_e4m3fnuz,torch.float8_e4m3fnuz,QuantType.per_Tensor,64,64,0,11918.0264,moe_ck2stages_gemm1_256x64x64x128_1x4_MulABScale_v1_Nswizzle0_Quant1_MulRoutedWeight0_silu_F8_F8_B16,0.0%,24158.7565,flydsl_moe2_afp8_wfp8_bf16_t64x128x64_atomic_w3_bnt0,0.1%,36076.7829,0,154.29,57.27,
80,2048,4096,192,193,9,ActivationType.Silu,torch.bfloat16,torch.float8_e4m3fnuz,torch.float8_e4m3fnuz,QuantType.per_Tensor,1,0,torch.float8_e4m3fnuz,torch.float8_e4m3fnuz,QuantType.per_Tensor,64,32,0,264.6795,moe_ck2stages_gemm1_256x64x64x128_1x4_MulABScale_v1_Nswizzle0_Quant1_MulRoutedWeight0_silu_F8_F8_B16,0.0,461.4904,moe_ck2stages_gemm2_256x32x64x64_1x4_MulABScaleExpertWeight_v1_Nswizzle0_Quant1_MulRoutedWeight1_F8_F8_B16,0.0009,726.1699,0,0.0,0.0,flydsl_fallback
80,4096,4096,192,193,9,ActivationType.Silu,torch.bfloat16,torch.float8_e4m3fnuz,torch.float8_e4m3fnuz,QuantType.per_Tensor,1,0,torch.float8_e4m3fnuz,torch.float8_e4m3fnuz,QuantType.per_Tensor,64,64,0,447.6221,moe_ck2stages_gemm1_256x64x64x128_1x4_MulABScale_v1_Nswizzle0_Quant1_MulRoutedWeight0_silu_F8_F8_B16,0.0,813.9443,moe_ck2stages_gemm2_256x64x64x64_1x4_MulABScaleExpertWeight_v1_Nswizzle0_Quant1_MulRoutedWeight1_F8_F8_B16,0.0009,1261.5664,0,0.0,0.0,flydsl_fallback
80,8192,4096,192,193,9,ActivationType.Silu,torch.bfloat16,torch.float8_e4m3fnuz,torch.float8_e4m3fnuz,QuantType.per_Tensor,1,0,torch.float8_e4m3fnuz,torch.float8_e4m3fnuz,QuantType.per_Tensor,64,64,0,800.8209,moe_ck2stages_gemm1_256x64x64x128_1x4_MulABScale_v1_Nswizzle0_Quant1_MulRoutedWeight0_silu_F8_F8_B16,0.0,1525.2989,moe_ck2stages_gemm2_256x64x64x64_1x4_MulABScaleExpertWeight_v1_Nswizzle0_Quant1_MulRoutedWeight1_F8_F8_B16,0.0009,2326.1198,0,0.0,0.0,flydsl_fallback
80,16384,4096,192,193,9,ActivationType.Silu,torch.bfloat16,torch.float8_e4m3fnuz,torch.float8_e4m3fnuz,QuantType.per_Tensor,1,0,torch.float8_e4m3fnuz,torch.float8_e4m3fnuz,QuantType.per_Tensor,64,64,0,1520.6436,moe_ck2stages_gemm1_256x64x64x128_1x4_MulABScale_v1_Nswizzle0_Quant1_MulRoutedWeight0_silu_F8_F8_B16,0.0,2993.8286,moe_ck2stages_gemm2_256x64x64x64_1x4_MulABScaleExpertWeight_v1_Nswizzle0_Quant1_MulRoutedWeight1_F8_F8_B16,0.0009,4514.4722,0,0.0,0.0,flydsl_fallback
80,65536,4096,192,193,9,ActivationType.Silu,torch.bfloat16,torch.float8_e4m3fnuz,torch.float8_e4m3fnuz,QuantType.per_Tensor,1,0,torch.float8_e4m3fnuz,torch.float8_e4m3fnuz,QuantType.per_Tensor,64,64,0,5941.9919,moe_ck2stages_gemm1_256x64x64x128_1x4_MulABScale_v1_Nswizzle0_Quant1_MulRoutedWeight0_silu_F8_F8_B16,0.0,12107.9762,moe_ck2stages_gemm2_256x64x64x64_1x4_MulABScaleExpertWeight_v1_Nswizzle0_Quant1_MulRoutedWeight1_F8_F8_B16,0.0009,18049.9681,0,0.0,0.0,flydsl_fallback
80,131072,4096,192,193,9,ActivationType.Silu,torch.bfloat16,torch.float8_e4m3fnuz,torch.float8_e4m3fnuz,QuantType.per_Tensor,1,0,torch.float8_e4m3fnuz,torch.float8_e4m3fnuz,QuantType.per_Tensor,64,64,0,11918.0264,moe_ck2stages_gemm1_256x64x64x128_1x4_MulABScale_v1_Nswizzle0_Quant1_MulRoutedWeight0_silu_F8_F8_B16,0.0,24279.6634,moe_ck2stages_gemm2_256x64x64x64_1x4_MulABScaleExpertWeight_v1_Nswizzle0_Quant1_MulRoutedWeight1_F8_F8_B16,0.0009,36197.6898,0,0.0,0.0,flydsl_fallback
80,1,4096,192,193,9,ActivationType.Silu,torch.bfloat16,torch.float8_e4m3fnuz,torch.float8_e4m3fnuz,QuantType.per_Tensor,1,0,torch.float8_e4m3fnuz,torch.float8_e4m3fnuz,QuantType.per_Tensor,16,16,0,13.9916,flydsl_moe1_direct_afp8_wfp8_bf16_t16x32x512_nw2_kb8,0.0%,10.599,flydsl_moe2_direct_afp8_wfp8_bf16_t16x256x64_sr,0.0%,24.5906,0,1.73,18517.5,
80,1,4096,192,193,9,ActivationType.Silu,torch.bfloat16,torch.float8_e4m3fnuz,torch.float8_e4m3fnuz,QuantType.per_Tensor,1,0,torch.float8_e4m3fnuz,torch.float8_e4m3fnuz,QuantType.per_Tensor,16,16,0,15.3347,moe_ck2stages_gemm1_256x16x64x256_1x4_MulABScale_v1_Nswizzle0_Quant1_MulRoutedWeight0_silu_F8_F8_B16,0.0,9.4385,moe_ck2stages_gemm2_64x16x64x64_1x1_MulABScaleExpertWeight_v1_Nswizzle0_Quant1_MulRoutedWeight1_F8_F8_B16,0.001,24.7732,0,0.0,0.0,flydsl_fallback
80,2,4096,192,193,9,ActivationType.Silu,torch.bfloat16,torch.float8_e4m3fnuz,torch.float8_e4m3fnuz,QuantType.per_Tensor,1,0,torch.float8_e4m3fnuz,torch.float8_e4m3fnuz,QuantType.per_Tensor,16,16,0,18.2937,flydsl_moe1_direct_afp8_wfp8_bf16_t16x32x128_nw2_kb8,0.0%,13.1312,flydsl_moe2_direct_afp8_wfp8_bf16_t16x32x64_sr,0.0%,31.4249,0,2.7,14490.7,
80,2,4096,192,193,9,ActivationType.Silu,torch.bfloat16,torch.float8_e4m3fnuz,torch.float8_e4m3fnuz,QuantType.per_Tensor,1,0,torch.float8_e4m3fnuz,torch.float8_e4m3fnuz,QuantType.per_Tensor,16,16,0,16.6857,moe_ck2stages_gemm1_256x16x64x256_1x4_MulABScale_v1_Nswizzle0_Quant1_MulRoutedWeight0_silu_F8_F8_B16,0.0,12.9504,moe_ck2stages_gemm2_64x16x64x64_1x1_MulABScaleExpertWeight_v1_Nswizzle0_Quant1_MulRoutedWeight1_F8_F8_B16,0.001,29.6361,0,0.0,0.0,flydsl_fallback
80,4,4096,192,193,9,ActivationType.Silu,torch.bfloat16,torch.float8_e4m3fnuz,torch.float8_e4m3fnuz,QuantType.per_Tensor,1,0,torch.float8_e4m3fnuz,torch.float8_e4m3fnuz,QuantType.per_Tensor,16,16,0,27.019,flydsl_moe1_direct_afp8_wfp8_bf16_t16x32x256_kb8,0.0%,17.7296,flydsl_moe2_direct_afp8_wfp8_bf16_t16x128x64_sr,0.0%,44.7486,0,3.8,10176.7,
80,4,4096,192,193,9,ActivationType.Silu,torch.bfloat16,torch.float8_e4m3fnuz,torch.float8_e4m3fnuz,QuantType.per_Tensor,1,0,torch.float8_e4m3fnuz,torch.float8_e4m3fnuz,QuantType.per_Tensor,16,16,0,23.6909,moe_ck2stages_gemm1_256x16x64x256_1x4_MulABScale_v1_Nswizzle0_Quant1_MulRoutedWeight0_silu_F8_F8_B16,0.0,19.8738,moe_ck2stages_gemm2_64x16x64x64_1x1_MulABScaleExpertWeight_v1_Nswizzle0_Quant1_MulRoutedWeight1_F8_F8_B16,0.0009,43.5647,0,0.0,0.0,flydsl_fallback
80,8,4096,192,193,9,ActivationType.Silu,torch.bfloat16,torch.float8_e4m3fnuz,torch.float8_e4m3fnuz,QuantType.per_Tensor,1,0,torch.float8_e4m3fnuz,torch.float8_e4m3fnuz,QuantType.per_Tensor,16,16,0,35.6898,flydsl_moe1_direct_afp8_wfp8_bf16_t16x32x256_nw2,0.0%,23.4314,flydsl_moe2_direct_afp8_wfp8_bf16_t16x128x64,0.0%,59.1212,0,5.75,7703.54,
80,8,4096,192,193,9,ActivationType.Silu,torch.bfloat16,torch.float8_e4m3fnuz,torch.float8_e4m3fnuz,QuantType.per_Tensor,1,0,torch.float8_e4m3fnuz,torch.float8_e4m3fnuz,QuantType.per_Tensor,16,16,0,37.65,moe_ck2stages_gemm1_128x16x64x128_1x2_MulABScale_v1_Nswizzle0_Quant1_MulRoutedWeight0_silu_F8_F8_B16,0.0,31.2061,moe_ck2stages_gemm2_64x16x64x64_1x1_MulABScaleExpertWeight_v1_Nswizzle0_Quant1_MulRoutedWeight1_F8_F8_B16,0.0008,68.8561,0,0.0,0.0,flydsl_fallback
80,16,4096,192,193,9,ActivationType.Silu,torch.bfloat16,torch.float8_e4m3fnuz,torch.float8_e4m3fnuz,QuantType.per_Tensor,1,0,torch.float8_e4m3fnuz,torch.float8_e4m3fnuz,QuantType.per_Tensor,16,16,0,57.0137,flydsl_moe1_direct_afp8_wfp8_bf16_t16x96x128,0.0%,38.8268,flydsl_moe2_direct_afp8_wfp8_bf16_t16x64x64,0.0%,95.8405,0,7.09,4753.11,
80,16,4096,192,193,9,ActivationType.Silu,torch.bfloat16,torch.float8_e4m3fnuz,torch.float8_e4m3fnuz,QuantType.per_Tensor,1,0,torch.float8_e4m3fnuz,torch.float8_e4m3fnuz,QuantType.per_Tensor,16,16,0,50.6964,moe_ck2stages_gemm1_128x16x64x128_1x2_MulABScale_v1_Nswizzle0_Quant1_MulRoutedWeight0_silu_F8_F8_B16,0.0,46.7812,moe_ck2stages_gemm2_64x16x64x64_1x1_MulABScaleExpertWeight_v1_Nswizzle0_Quant1_MulRoutedWeight1_F8_F8_B16,0.0008,97.4776,0,0.0,0.0,flydsl_fallback
