aiter/configs/model_configs/hy3_fp8_pertensor_tuned_fmoe.csv
cu_num,token,model_dim,inter_dim,expert,topk,act_type,dtype,q_dtype_a,q_dtype_w,q_type,use_g1u1,doweight_stage1,q_dtype_a2,q_dtype_w2,q_type2,block_m,block_m2,ksplit,us1,kernelName1,err1,us2,kernelName2,err2,us,run_1stage,tflops,bw,_tag
80,1,4096,192,193,9,ActivationType.Silu,torch.bfloat16,torch.float8_e4m3fnuz,torch.float8_e4m3fnuz,QuantType.per_Tensor,1,0,torch.float8_e4m3fnuz,torch.float8_e4m3fnuz,QuantType.per_Tensor,16,16,0,16.2913,flydsl_moe1_direct_afp8_wfp8_bf16_t16x16x256_kb8_red,0.0%,11.0071,flydsl_moe2_direct_afp8_wfp8_bf16_t16x256x64_sr,0.0%,27.2984,0,1.56,16680.7,
80,2,4096,192,193,9,ActivationType.Silu,torch.bfloat16,torch.float8_e4m3fnuz,torch.float8_e4m3fnuz,QuantType.per_Tensor,1,0,torch.float8_e4m3fnuz,torch.float8_e4m3fnuz,QuantType.per_Tensor,16,16,0,22.2713,flydsl_moe1_direct_afp8_wfp8_bf16_t16x16x64_kb8_red,0.0%,14.5085,flydsl_moe2_direct_afp8_wfp8_bf16_t16x64x64_sr,0.0%,36.7798,0,2.31,12380.95,
80,4,4096,192,193,9,ActivationType.Silu,torch.bfloat16,torch.float8_e4m3fnuz,torch.float8_e4m3fnuz,QuantType.per_Tensor,1,0,torch.float8_e4m3fnuz,torch.float8_e4m3fnuz,QuantType.per_Tensor,16,16,0,34.1377,flydsl_moe1_direct_afp8_wfp8_bf16_t16x64x128_nw2_kb8_red,0.0%,21.7526,flydsl_moe2_direct_afp8_wfp8_bf16_t16x256x64_sr,0.0%,55.8903,0,3.04,8147.98,
80,8,4096,192,193,9,ActivationType.Silu,torch.bfloat16,torch.float8_e4m3fnuz,torch.float8_e4m3fnuz,QuantType.per_Tensor,1,0,torch.float8_e4m3fnuz,torch.float8_e4m3fnuz,QuantType.per_Tensor,16,16,0,52.6394,flydsl_moe1_direct_afp8_wfp8_bf16_t16x32x128_nw2,0.0%,31.5435,flydsl_moe2_direct_afp8_wfp8_bf16_t16x128x64,0.0%,84.1829,0,4.04,5410.15,
80,16,4096,192,193,9,ActivationType.Silu,torch.bfloat16,torch.float8_e4m3fnuz,torch.float8_e4m3fnuz,QuantType.per_Tensor,1,0,torch.float8_e4m3fnuz,torch.float8_e4m3fnuz,QuantType.per_Tensor,16,16,0,86.039,moe_ck2stages_gemm1_256x16x64x256_1x4_MulABScale_v1_Nswizzle0_Quant1_MulRoutedWeight0_silu_F8_F8_B16,0.0%,56.7238,flydsl_moe2_direct_afp8_wfp8_bf16_t16x64x64,0.0%,142.7628,0,4.76,3190.89,
80,32,4096,192,193,9,ActivationType.Silu,torch.bfloat16,torch.float8_e4m3fnuz,torch.float8_e4m3fnuz,QuantType.per_Tensor,1,0,torch.float8_e4m3fnuz,torch.float8_e4m3fnuz,QuantType.per_Tensor,16,16,0,121.7604,moe_ck2stages_gemm1_256x16x64x256_1x4_MulABScale_v1_Nswizzle0_Quant1_MulRoutedWeight0_silu_F8_F8_B16,0.0%,79.8218,flydsl_moe2_afp8_wfp8_bf16_t16x128x64_atomic_bnt0,0.1%,201.5822,0,6.74,2260.8,
80,64,4096,192,193,9,ActivationType.Silu,torch.bfloat16,torch.float8_e4m3fnuz,torch.float8_e4m3fnuz,QuantType.per_Tensor,1,0,torch.float8_e4m3fnuz,torch.float8_e4m3fnuz,QuantType.per_Tensor,16,16,0,129.5828,moe_ck2stages_gemm1_256x16x64x256_1x4_MulABScale_v1_Nswizzle0_Quant1_MulRoutedWeight0_silu_F8_F8_B16,0.0%,96.075,flydsl_moe2_afp8_wfp8_bf16_t16x128x64_atomic_w4_bnt0,0.1%,225.6578,0,12.04,2021.34,
80,128,4096,192,193,9,ActivationType.Silu,torch.bfloat16,torch.float8_e4m3fnuz,torch.float8_e4m3fnuz,QuantType.per_Tensor,1,0,torch.float8_e4m3fnuz,torch.float8_e4m3fnuz,QuantType.per_Tensor,16,16,0,140.9001,moe_ck2stages_gemm1_256x16x64x256_1x4_MulABScale_v1_Nswizzle0_Quant1_MulRoutedWeight0_silu_F8_F8_B16,0.0%,103.5136,flydsl_moe2_afp8_wfp8_bf16_t16x128x64_atomic_w1_bnt0,0.1%,244.4137,0,22.24,1869.44,
80,256,4096,192,193,9,ActivationType.Silu,torch.bfloat16,torch.float8_e4m3fnuz,torch.float8_e4m3fnuz,QuantType.per_Tensor,1,0,torch.float8_e4m3fnuz,torch.float8_e4m3fnuz,QuantType.per_Tensor,32,32,0,159.1304,moe_ck2stages_gemm1_256x32x64x256_1x4_MulABScale_v1_Nswizzle0_Quant1_MulRoutedWeight0_silu_F8_F8_B16,0.0%,126.8733,flydsl_moe2_afp8_wfp8_bf16_t32x128x64_atomic_w1_bnt0,0.1%,286.0037,0,38.01,1603.09,
80,512,4096,192,193,9,ActivationType.Silu,torch.bfloat16,torch.float8_e4m3fnuz,torch.float8_e4m3fnuz,QuantType.per_Tensor,1,0,torch.float8_e4m3fnuz,torch.float8_e4m3fnuz,QuantType.per_Tensor,32,32,0,176.05499999999998,moe_ck2stages_gemm1_256x32x64x256_1x4_MulABScale_v1_Nswizzle0_Quant1_MulRoutedWeight0_silu_F8_F8_B16,0.0%,142.0865,flydsl_moe2_afp8_wfp8_bf16_t32x128x64_atomic_w2_bnt0,0.1%,318.1415,0,68.34,1451.04,
80,1024,4096,192,193,9,ActivationType.Silu,torch.bfloat16,torch.float8_e4m3fnuz,torch.float8_e4m3fnuz,QuantType.per_Tensor,1,0,torch.float8_e4m3fnuz,torch.float8_e4m3fnuz,QuantType.per_Tensor,64,32,0,241.155,moe_ck2stages_gemm1_256x64x64x256_1x4_MulABScale_v1_Nswizzle0_Quant1_MulRoutedWeight0_silu_F8_F8_B16,0.0%,214.6762,flydsl_moe2_afp8_wfp8_bf16_t32x128x64_atomic_w4_bnt0,0.1%,455.8312,0,95.4,1026.54,
80,2048,4096,192,193,9,ActivationType.Silu,torch.bfloat16,torch.float8_e4m3fnuz,torch.float8_e4m3fnuz,QuantType.per_Tensor,1,0,torch.float8_e4m3fnuz,torch.float8_e4m3fnuz,QuantType.per_Tensor,128,32,0,375.5235,moe_ck2stages_gemm1_256x128x64x128_1x4_MulABScale_v1_Nswizzle0_Quant1_MulRoutedWeight0_silu_F8_F8_B16,0.0%,353.1988,flydsl_moe2_afp8_wfp8_bf16_t32x128x64_atomic_w2_bnt0,0.1%,728.7223,0,119.35,659.39,
80,4096,4096,192,193,9,ActivationType.Silu,torch.bfloat16,torch.float8_e4m3fnuz,torch.float8_e4m3fnuz,QuantType.per_Tensor,1,0,torch.float8_e4m3fnuz,torch.float8_e4m3fnuz,QuantType.per_Tensor,128,32,0,653.9085,moe_ck2stages_gemm1_256x128x64x128_1x4_MulABScale_v1_Nswizzle0_Quant1_MulRoutedWeight0_silu_F8_F8_B16,0.0%,640.7155,flydsl_moe2_afp8_wfp8_bf16_t32x128x64_atomic_w3_bnt0,0.1%,1294.624,0,134.36,390.6,
80,8192,4096,192,193,9,ActivationType.Silu,torch.bfloat16,torch.float8_e4m3fnuz,torch.float8_e4m3fnuz,QuantType.per_Tensor,1,0,torch.float8_e4m3fnuz,torch.float8_e4m3fnuz,QuantType.per_Tensor,128,32,0,1119.9917,moe_ck2stages_gemm1_256x128x64x128_1x4_MulABScale_v1_Nswizzle0_Quant1_MulRoutedWeight0_silu_F8_F8_B16,0.0%,1297.4335,flydsl_moe2_afp8_wfp8_bf16_t32x128x64_atomic_w3_bnt0,0.1%,2417.4252,0,143.91,230.0,
80,16384,4096,192,193,9,ActivationType.Silu,torch.bfloat16,torch.float8_e4m3fnuz,torch.float8_e4m3fnuz,QuantType.per_Tensor,1,0,torch.float8_e4m3fnuz,torch.float8_e4m3fnuz,QuantType.per_Tensor,128,32,0,1989.8358,moe_ck2stages_gemm1_256x128x64x128_1x4_MulABScale_v1_Nswizzle0_Quant1_MulRoutedWeight0_silu_F8_F8_B16,0.0%,2776.5226,flydsl_moe2_afp8_wfp8_bf16_t32x128x64_atomic_bnt0,0.1%,4766.3584,0,145.98,137.77,
80,32768,4096,192,193,9,ActivationType.Silu,torch.bfloat16,torch.float8_e4m3fnuz,torch.float8_e4m3fnuz,QuantType.per_Tensor,1,0,torch.float8_e4m3fnuz,torch.float8_e4m3fnuz,QuantType.per_Tensor,128,32,0,3671.5327,moe_ck2stages_gemm1_256x128x64x128_1x4_MulABScale_v1_Nswizzle0_Quant1_MulRoutedWeight0_silu_F8_F8_B16,0.0%,5567.4859,flydsl_moe2_afp8_wfp8_bf16_t32x128x64_atomic_w2_bnt0,0.1%,9239.0186,0,150.62,92.87,
80,65536,4096,192,193,9,ActivationType.Silu,torch.bfloat16,torch.float8_e4m3fnuz,torch.float8_e4m3fnuz,QuantType.per_Tensor,1,0,torch.float8_e4m3fnuz,torch.float8_e4m3fnuz,QuantType.per_Tensor,128,32,0,7191.3768,moe_ck2stages_gemm1_256x128x64x128_1x4_MulABScale_v1_Nswizzle0_Quant1_MulRoutedWeight0_silu_F8_F8_B16,0.0%,11236.7219,flydsl_moe2_afp8_wfp8_bf16_t32x128x64_atomic_bnt0,0.1%,18428.0987,0,151.03,68.41,
80,131072,4096,192,193,9,ActivationType.Silu,torch.bfloat16,torch.float8_e4m3fnuz,torch.float8_e4m3fnuz,QuantType.per_Tensor,1,0,torch.float8_e4m3fnuz,torch.float8_e4m3fnuz,QuantType.per_Tensor,128,32,0,14290.2204,moe_ck2stages_gemm1_256x128x64x128_1x4_MulABScale_v1_Nswizzle0_Quant1_MulRoutedWeight0_silu_F8_F8_B16,0.0%,22509.381,flydsl_moe2_afp8_wfp8_bf16_t32x128x64_atomic_w2_bnt0,0.1%,36799.6014,0,151.26,56.14,
80,1,4096,192,193,9,ActivationType.Silu,torch.bfloat16,torch.float8_e4m3fnuz,torch.float8_e4m3fnuz,QuantType.per_Tensor,1,0,torch.float8_e4m3fnuz,torch.float8_e4m3fnuz,QuantType.per_Tensor,16,16,0,17.6763,moe_ck2stages_gemm1_256x16x64x256_1x4_MulABScale_v1_Nswizzle0_Quant1_MulRoutedWeight0_silu_F8_F8_B16,0.0,11.0753,moe_ck2stages_gemm2_64x16x64x64_1x1_MulABScaleExpertWeight_v1_Nswizzle0_Quant1_MulRoutedWeight1_F8_F8_B16,0.001,28.7516,0,0.0,0.0,flydsl_fallback
80,2,4096,192,193,9,ActivationType.Silu,torch.bfloat16,torch.float8_e4m3fnuz,torch.float8_e4m3fnuz,QuantType.per_Tensor,1,0,torch.float8_e4m3fnuz,torch.float8_e4m3fnuz,QuantType.per_Tensor,16,16,0,21.3979,moe_ck2stages_gemm1_256x16x64x256_1x4_MulABScale_v1_Nswizzle0_Quant1_MulRoutedWeight0_silu_F8_F8_B16,0.0,13.6901,moe_ck2stages_gemm2_64x16x64x64_1x1_MulABScaleExpertWeight_v1_Nswizzle0_Quant1_MulRoutedWeight1_F8_F8_B16,0.0007,35.088,0,0.0,0.0,flydsl_fallback
80,4,4096,192,193,9,ActivationType.Silu,torch.bfloat16,torch.float8_e4m3fnuz,torch.float8_e4m3fnuz,QuantType.per_Tensor,1,0,torch.float8_e4m3fnuz,torch.float8_e4m3fnuz,QuantType.per_Tensor,16,16,0,31.8767,moe_ck2stages_gemm1_256x16x64x256_1x4_MulABScale_v1_Nswizzle0_Quant1_MulRoutedWeight0_silu_F8_F8_B16,0.0,24.9165,moe_ck2stages_gemm2_64x16x64x64_1x1_MulABScaleExpertWeight_v1_Nswizzle0_Quant1_MulRoutedWeight1_F8_F8_B16,0.0009,56.7932,0,0.0,0.0,flydsl_fallback
80,8,4096,192,193,9,ActivationType.Silu,torch.bfloat16,torch.float8_e4m3fnuz,torch.float8_e4m3fnuz,QuantType.per_Tensor,1,0,torch.float8_e4m3fnuz,torch.float8_e4m3fnuz,QuantType.per_Tensor,16,16,0,48.0438,moe_ck2stages_gemm1_256x16x64x256_1x4_MulABScale_v1_Nswizzle0_Quant1_MulRoutedWeight0_silu_F8_F8_B16,0.0,37.7829,moe_ck2stages_gemm2_64x16x64x64_1x1_MulABScaleExpertWeight_v1_Nswizzle0_Quant1_MulRoutedWeight1_F8_F8_B16,0.0007,85.8267,0,0.0,0.0,flydsl_fallback
80,16,4096,192,193,9,ActivationType.Silu,torch.bfloat16,torch.float8_e4m3fnuz,torch.float8_e4m3fnuz,QuantType.per_Tensor,1,0,torch.float8_e4m3fnuz,torch.float8_e4m3fnuz,QuantType.per_Tensor,16,16,0,71.5154,moe_ck2stages_gemm1_256x16x64x256_1x4_MulABScale_v1_Nswizzle0_Quant1_MulRoutedWeight0_silu_F8_F8_B16,0.0,58.4339,moe_ck2stages_gemm2_64x16x64x64_1x1_MulABScaleExpertWeight_v1_Nswizzle0_Quant1_MulRoutedWeight1_F8_F8_B16,0.0009,129.9493,0,0.0,0.0,flydsl_fallback
80,32,4096,192,193,9,ActivationType.Silu,torch.bfloat16,torch.float8_e4m3fnuz,torch.float8_e4m3fnuz,QuantType.per_Tensor,1,0,torch.float8_e4m3fnuz,torch.float8_e4m3fnuz,QuantType.per_Tensor,16,16,0,100.9852,moe_ck2stages_gemm1_256x16x64x256_1x4_MulABScale_v1_Nswizzle0_Quant1_MulRoutedWeight0_silu_F8_F8_B16,0.0,81.5322,moe_ck2stages_gemm2_64x16x64x64_1x1_MulABScaleExpertWeight_v1_Nswizzle0_Quant1_MulRoutedWeight1_F8_F8_B16,0.001,182.5174,0,0.0,0.0,flydsl_fallback
80,64,4096,192,193,9,ActivationType.Silu,torch.bfloat16,torch.float8_e4m3fnuz,torch.float8_e4m3fnuz,QuantType.per_Tensor,1,0,torch.float8_e4m3fnuz,torch.float8_e4m3fnuz,QuantType.per_Tensor,16,16,0,119.4791,moe_ck2stages_gemm1_256x16x64x256_1x4_MulABScale_v1_Nswizzle0_Quant1_MulRoutedWeight0_silu_F8_F8_B16,0.0,100.3547,moe_ck2stages_gemm2_64x16x64x64_1x1_MulABScaleExpertWeight_v1_Nswizzle0_Quant1_MulRoutedWeight1_F8_F8_B16,0.0009,219.8338,0,0.0,0.0,flydsl_fallback
80,128,4096,192,193,9,ActivationType.Silu,torch.bfloat16,torch.float8_e4m3fnuz,torch.float8_e4m3fnuz,QuantType.per_Tensor,1,0,torch.float8_e4m3fnuz,torch.float8_e4m3fnuz,QuantType.per_Tensor,16,16,0,130.7588,moe_ck2stages_gemm1_256x16x64x256_1x4_MulABScale_v1_Nswizzle0_Quant1_MulRoutedWeight0_silu_F8_F8_B16,0.0,115.1532,moe_ck2stages_gemm2_64x16x64x64_1x1_MulABScaleExpertWeight_v1_Nswizzle0_Quant1_MulRoutedWeight1_F8_F8_B16,0.0008,245.912,0,0.0,0.0,flydsl_fallback
80,256,4096,192,193,9,ActivationType.Silu,torch.bfloat16,torch.float8_e4m3fnuz,torch.float8_e4m3fnuz,QuantType.per_Tensor,1,0,torch.float8_e4m3fnuz,torch.float8_e4m3fnuz,QuantType.per_Tensor,32,16,0,148.1131,moe_ck2stages_gemm1_256x32x64x256_1x4_MulABScale_v1_Nswizzle0_Quant1_MulRoutedWeight0_silu_F8_F8_B16,0.0,145.7687,moe_ck2stages_gemm2_64x16x64x64_1x1_MulABScaleExpertWeight_v1_Nswizzle0_Quant1_MulRoutedWeight1_F8_F8_B16,0.0008,293.8818,0,0.0,0.0,flydsl_fallback
80,512,4096,192,193,9,ActivationType.Silu,torch.bfloat16,torch.float8_e4m3fnuz,torch.float8_e4m3fnuz,QuantType.per_Tensor,1,0,torch.float8_e4m3fnuz,torch.float8_e4m3fnuz,QuantType.per_Tensor,32,32,0,161.6067,moe_ck2stages_gemm1_256x32x64x256_1x4_MulABScale_v1_Nswizzle0_Quant1_MulRoutedWeight0_silu_F8_F8_B16,0.0,165.8248,moe_ck2stages_gemm2_256x32x64x64_1x4_MulABScaleExpertWeight_v1_Nswizzle0_Quant1_MulRoutedWeight1_F8_F8_B16,0.0009,327.4315,0,0.0,0.0,flydsl_fallback
80,1024,4096,192,193,9,ActivationType.Silu,torch.bfloat16,torch.float8_e4m3fnuz,torch.float8_e4m3fnuz,QuantType.per_Tensor,1,0,torch.float8_e4m3fnuz,torch.float8_e4m3fnuz,QuantType.per_Tensor,64,64,0,205.6186,moe_ck2stages_gemm1_256x64x64x256_1x4_MulABScale_v1_Nswizzle0_Quant1_MulRoutedWeight0_silu_F8_F8_B16,0.0,242.9759,moe_ck2stages_gemm2_256x64x64x64_1x4_MulABScaleExpertWeight_v1_Nswizzle0_Quant1_MulRoutedWeight1_F8_F8_B16,0.0009,448.5945,0,0.0,0.0,flydsl_fallback
80,2048,4096,192,193,9,ActivationType.Silu,torch.bfloat16,torch.float8_e4m3fnuz,torch.float8_e4m3fnuz,QuantType.per_Tensor,1,0,torch.float8_e4m3fnuz,torch.float8_e4m3fnuz,QuantType.per_Tensor,128,32,0,316.0753,moe_ck2stages_gemm1_256x128x64x128_1x4_MulABScale_v1_Nswizzle0_Quant1_MulRoutedWeight0_silu_F8_F8_B16,0.0,464.8602,moe_ck2stages_gemm2_256x32x64x64_1x4_MulABScaleExpertWeight_v1_Nswizzle0_Quant1_MulRoutedWeight1_F8_F8_B16,0.0009,780.9355,0,0.0,0.0,flydsl_fallback
80,4096,4096,192,193,9,ActivationType.Silu,torch.bfloat16,torch.float8_e4m3fnuz,torch.float8_e4m3fnuz,QuantType.per_Tensor,1,0,torch.float8_e4m3fnuz,torch.float8_e4m3fnuz,QuantType.per_Tensor,128,64,0,582.1451,moe_ck2stages_gemm1_256x128x64x128_1x4_MulABScale_v1_Nswizzle0_Quant1_MulRoutedWeight0_silu_F8_F8_B16,0.0,805.5243,moe_ck2stages_gemm2_256x64x64x64_1x4_MulABScaleExpertWeight_v1_Nswizzle0_Quant1_MulRoutedWeight1_F8_F8_B16,0.0009,1387.6694,0,0.0,0.0,flydsl_fallback
80,8192,4096,192,193,9,ActivationType.Silu,torch.bfloat16,torch.float8_e4m3fnuz,torch.float8_e4m3fnuz,QuantType.per_Tensor,1,0,torch.float8_e4m3fnuz,torch.float8_e4m3fnuz,QuantType.per_Tensor,128,64,0,1016.793,moe_ck2stages_gemm1_256x128x64x128_1x4_MulABScale_v1_Nswizzle0_Quant1_MulRoutedWeight0_silu_F8_F8_B16,0.0,1511.6441,moe_ck2stages_gemm2_256x64x64x64_1x4_MulABScaleExpertWeight_v1_Nswizzle0_Quant1_MulRoutedWeight1_F8_F8_B16,0.0009,2528.4371,0,0.0,0.0,flydsl_fallback
80,16384,4096,192,193,9,ActivationType.Silu,torch.bfloat16,torch.float8_e4m3fnuz,torch.float8_e4m3fnuz,QuantType.per_Tensor,1,0,torch.float8_e4m3fnuz,torch.float8_e4m3fnuz,QuantType.per_Tensor,128,64,0,1809.1626,moe_ck2stages_gemm1_256x128x64x128_1x4_MulABScale_v1_Nswizzle0_Quant1_MulRoutedWeight0_silu_F8_F8_B16,0.0,2988.6123,moe_ck2stages_gemm2_256x64x64x64_1x4_MulABScaleExpertWeight_v1_Nswizzle0_Quant1_MulRoutedWeight1_F8_F8_B16,0.0009,4797.7749,0,0.0,0.0,flydsl_fallback
80,32768,4096,192,193,9,ActivationType.Silu,torch.bfloat16,torch.float8_e4m3fnuz,torch.float8_e4m3fnuz,QuantType.per_Tensor,1,0,torch.float8_e4m3fnuz,torch.float8_e4m3fnuz,QuantType.per_Tensor,128,64,0,3334.6451,moe_ck2stages_gemm1_256x128x64x128_1x4_MulABScale_v1_Nswizzle0_Quant1_MulRoutedWeight0_silu_F8_F8_B16,0.0,5964.1032,moe_ck2stages_gemm2_256x64x64x64_1x4_MulABScaleExpertWeight_v1_Nswizzle0_Quant1_MulRoutedWeight1_F8_F8_B16,0.0009,9298.7483,0,0.0,0.0,flydsl_fallback
80,65536,4096,192,193,9,ActivationType.Silu,torch.bfloat16,torch.float8_e4m3fnuz,torch.float8_e4m3fnuz,QuantType.per_Tensor,1,0,torch.float8_e4m3fnuz,torch.float8_e4m3fnuz,QuantType.per_Tensor,128,64,0,6543.5904,moe_ck2stages_gemm1_256x128x64x128_1x4_MulABScale_v1_Nswizzle0_Quant1_MulRoutedWeight0_silu_F8_F8_B16,0.0,12155.6837,moe_ck2stages_gemm2_256x64x64x64_1x4_MulABScaleExpertWeight_v1_Nswizzle0_Quant1_MulRoutedWeight1_F8_F8_B16,0.0009,18699.2741,0,0.0,0.0,flydsl_fallback
80,131072,4096,192,193,9,ActivationType.Silu,torch.bfloat16,torch.float8_e4m3fnuz,torch.float8_e4m3fnuz,QuantType.per_Tensor,1,0,torch.float8_e4m3fnuz,torch.float8_e4m3fnuz,QuantType.per_Tensor,128,64,0,13012.723,moe_ck2stages_gemm1_256x128x64x128_1x4_MulABScale_v1_Nswizzle0_Quant1_MulRoutedWeight0_silu_F8_F8_B16,0.0,24271.6121,moe_ck2stages_gemm2_256x64x64x64_1x4_MulABScaleExpertWeight_v1_Nswizzle0_Quant1_MulRoutedWeight1_F8_F8_B16,0.0009,37284.3351,0,0.0,0.0,flydsl_fallback
80,2,4096,1536,12,8,ActivationType.Silu,torch.bfloat16,torch.float8_e4m3fnuz,torch.float8_e4m3fnuz,QuantType.per_Tensor,1,0,torch.float8_e4m3fnuz,torch.float8_e4m3fnuz,QuantType.per_Tensor,16,16,0,46.1466,moe_ck2stages_gemm1_256x16x64x256_1x4_MulABScale_v1_Nswizzle0_Quant1_MulRoutedWeight0_silu_F8_F8_B16,0.0%,31.3597,moe_ck2stages_gemm2_256x16x128x256_1x4_MulABScaleExpertWeight_v1_Nswizzle0_Quant1_MulRoutedWeight1_F8_F8_B16,2.9%,77.5063,0,7.79,2922.56,
80,4,4096,1536,12,8,ActivationType.Silu,torch.bfloat16,torch.float8_e4m3fnuz,torch.float8_e4m3fnuz,QuantType.per_Tensor,1,0,torch.float8_e4m3fnuz,torch.float8_e4m3fnuz,QuantType.per_Tensor,16,16,0,46.7311,moe_ck2stages_gemm1_256x16x64x256_1x4_MulABScale_v1_Nswizzle0_Quant1_MulRoutedWeight0_silu_F8_F8_B16,0.0%,29.8112,moe_ck2stages_gemm2_256x16x128x256_1x4_MulABScaleExpertWeight_v1_Nswizzle0_Quant1_MulRoutedWeight1_F8_F8_B16,2.7%,76.5423,0,15.78,2959.69,
80,8,4096,1536,12,8,ActivationType.Silu,torch.bfloat16,torch.float8_e4m3fnuz,torch.float8_e4m3fnuz,QuantType.per_Tensor,1,0,torch.float8_e4m3fnuz,torch.float8_e4m3fnuz,QuantType.per_Tensor,16,16,0,51.1375,moe_ck2stages_gemm1_256x16x64x256_1x4_MulABScale_v1_Nswizzle0_Quant1_MulRoutedWeight0_silu_F8_F8_B16,0.0%,32.4825,moe_ck2stages_gemm2_256x16x128x256_1x4_MulABScaleExpertWeight_v1_Nswizzle0_Quant1_MulRoutedWeight1_F8_F8_B16,2.4%,83.62,0,28.89,2709.77,
80,16,4096,1536,12,8,ActivationType.Silu,torch.bfloat16,torch.float8_e4m3fnuz,torch.float8_e4m3fnuz,QuantType.per_Tensor,1,0,torch.float8_e4m3fnuz,torch.float8_e4m3fnuz,QuantType.per_Tensor,16,16,0,51.2035,moe_ck2stages_gemm1_256x16x64x256_1x4_MulABScale_v1_Nswizzle0_Quant1_MulRoutedWeight0_silu_F8_F8_B16,0.0%,33.7869,moe_ck2stages_gemm2_256x16x128x256_1x4_MulABScaleExpertWeight_v1_Nswizzle0_Quant1_MulRoutedWeight1_F8_F8_B16,2.4%,84.9904,0,56.85,2667.23,
80,2,4096,1536,13,9,ActivationType.Silu,torch.bfloat16,torch.float8_e4m3fnuz,torch.float8_e4m3fnuz,QuantType.per_Tensor,1,0,torch.float8_e4m3fnuz,torch.float8_e4m3fnuz,QuantType.per_Tensor,16,16,0,50.5355,moe_ck2stages_gemm1_128x16x64x128_1x2_MulABScale_v1_Nswizzle0_Quant1_MulRoutedWeight0_silu_F8_F8_B16,0.0%,31.0585,moe_ck2stages_gemm2_256x16x128x256_1x4_MulABScaleExpertWeight_v1_Nswizzle0_Quant1_MulRoutedWeight1_F8_F8_B16,2.8%,81.594,0,8.33,3007.47,
80,4,4096,1536,13,9,ActivationType.Silu,torch.bfloat16,torch.float8_e4m3fnuz,torch.float8_e4m3fnuz,QuantType.per_Tensor,1,0,torch.float8_e4m3fnuz,torch.float8_e4m3fnuz,QuantType.per_Tensor,16,16,0,52.0267,moe_ck2stages_gemm1_256x16x64x256_1x4_MulABScale_v1_Nswizzle0_Quant1_MulRoutedWeight0_silu_F8_F8_B16,0.0%,33.8661,moe_ck2stages_gemm2_256x16x128x256_1x4_MulABScaleExpertWeight_v1_Nswizzle0_Quant1_MulRoutedWeight1_F8_F8_B16,2.6%,85.8928,0,15.82,2857.24,
80,8,4096,1536,13,9,ActivationType.Silu,torch.bfloat16,torch.float8_e4m3fnuz,torch.float8_e4m3fnuz,QuantType.per_Tensor,1,0,torch.float8_e4m3fnuz,torch.float8_e4m3fnuz,QuantType.per_Tensor,16,16,0,52.7407,moe_ck2stages_gemm1_256x16x64x256_1x4_MulABScale_v1_Nswizzle0_Quant1_MulRoutedWeight0_silu_F8_F8_B16,0.0%,34.7395,moe_ck2stages_gemm2_256x16x128x256_1x4_MulABScaleExpertWeight_v1_Nswizzle0_Quant1_MulRoutedWeight1_F8_F8_B16,2.6%,87.4802,0,31.07,2805.95,
80,16,4096,1536,13,9,ActivationType.Silu,torch.bfloat16,torch.float8_e4m3fnuz,torch.float8_e4m3fnuz,QuantType.per_Tensor,1,0,torch.float8_e4m3fnuz,torch.float8_e4m3fnuz,QuantType.per_Tensor,16,16,0,53.3339,moe_ck2stages_gemm1_256x16x64x256_1x4_MulABScale_v1_Nswizzle0_Quant1_MulRoutedWeight0_silu_F8_F8_B16,0.0%,37.0764,moe_ck2stages_gemm2_256x16x128x256_1x4_MulABScaleExpertWeight_v1_Nswizzle0_Quant1_MulRoutedWeight1_F8_F8_B16,2.5%,90.4103,0,60.12,2716.1,